{
  "$schema": "https://json-schema.org/draft/2020-12/schema",
  "$id": "progress.schema.json",
  "title": "classroom50 progress data",
  "description": "Collection data for one classroom, generated by scripts/generate_progress.py and committed by the publish workflow. Lives at <classroom>/data/progress.json. Not edited by hand.",
  "type": "object",
  "required": ["schema", "classroom", "generated_at", "assignments", "students", "cells"],
  "additionalProperties": false,
  "properties": {
    "schema": { "const": "nsu-syspro/progress/v1" },
    "classroom": { "type": "string" },
    "classroom_title": { "type": "string" },
    "generated_at": {
      "type": "string",
      "format": "date-time",
      "description": "When this snapshot was generated (UTC). Ignored by content-change detection."
    },
    "assignments": {
      "type": "array",
      "items": {
        "type": "object",
        "required": ["slug", "name", "due", "max_score", "submitted"],
        "additionalProperties": false,
        "properties": {
          "slug": { "type": "string" },
          "name": { "type": "string" },
          "due": { "type": ["string", "null"], "format": "date-time" },
          "max_score": { "type": "integer", "minimum": 0 },
          "collected_at": {
            "type": ["string", "null"],
            "format": "date-time",
            "description": "When scores for this assignment were last collected. Ignored by content-change detection."
          },
          "submitted": { "type": "integer", "minimum": 0 }
        }
      }
    },
    "students": {
      "type": "array",
      "items": {
        "type": "object",
        "required": ["username", "display"],
        "additionalProperties": false,
        "properties": {
          "username": { "type": "string" },
          "display": { "type": "string", "description": "Full name from the roster, or the username as fallback." },
          "zachet": {
            "enum": ["pass", "fail", null],
            "description": "Credit over all past-due published assignments: each needs at least PASS_THRESHOLD (8) accepted_score points. null = the student has no submissions at all (page shows a dash)."
          }
        }
      }
    },
    "cells": {
      "type": "array",
      "description": "One entry per (student, assignment) with at least one collected submission.",
      "items": {
        "type": "object",
        "required": ["student", "assignment", "score", "max_score", "review", "pr_url"],
        "additionalProperties": false,
        "properties": {
          "student": { "type": "string" },
          "assignment": { "type": "string" },
          "score": { "type": ["integer", "null"], "minimum": 0 },
          "max_score": { "type": "integer", "minimum": 0 },
          "review": {
            "enum": ["approved", "changes_requested", "unreviewed", "closed", "no_pr", "unknown"]
          },
          "accepted_score": {
            "type": "integer",
            "minimum": 0,
            "description": "Points the teacher has accepted so far. APPROVED review: the autograder total. CHANGES_REQUESTED: the sum of the full points of the tasks checked in the review body's task list (- [x] Задание №N); 0 when the review has no task list. 0 while unreviewed. Overridden to the full total for cells in publish.json 'overrides'."
          },
          "tasks": {
            "type": "array",
            "description": "Per-task states for the assignment's point-bearing tests (tests with points > 0, in task order; zero-point 'setup' tests excluded). accepted = counts toward accepted_score (green), even when the auto-tests score 0; rejected = the review rejected the task and its auto-tests pass, ball with the student (red); pending = submitted and awaiting review, first submission or resubmitted fix (yellow); failed = auto-tests do not pass (gray), including tasks unchecked by a review whose auto-tests score 0.",
            "items": { "enum": ["accepted", "rejected", "pending", "failed"] }
          },
          "fix_submitted": {
            "type": "boolean",
            "description": "True when the last verdict on the PR is CHANGES_REQUESTED and the student re-submitted after that review was posted: the fix is back 'under review' until the teacher re-reviews. False for every other state."
          },
          "pr_url": { "type": "string", "format": "uri" },
          "release_url": { "type": "string", "format": "uri" },
          "last_student_comment": {
            "type": "object",
            "description": "Latest comment authored by the student on the Feedback PR (conversation or inline review thread). Teacher-side discussion triage signal; not rendered on the status page. Absent when the student never commented.",
            "additionalProperties": false,
            "required": ["at", "body"],
            "properties": {
              "at": { "type": "string", "format": "date-time" },
              "body": { "type": "string", "maxLength": 120 }
            }
          }
        }
      }
    }
  }
}
