{
 "schema": "nsu-syspro/progress/v1",
 "classroom": "mpt",
 "classroom_title": "Modern Programmer's Tools",
 "generated_at": "2026-10-24T09:23:34Z",
 "assignments": [
  {
   "slug": "command-line-basics",
   "name": "Command-line basics",
   "due": "2026-09-11T16:59:00Z",
   "max_score": 10,
   "collected_at": "2026-10-24T09:23:14Z",
   "submitted": 17
  },
  {
   "slug": "regex-basics",
   "name": "Regex basics",
   "due": "2026-09-18T16:59:00Z",
   "max_score": 10,
   "collected_at": "2026-10-24T09:23:14Z",
   "submitted": 17
  },
  {
   "slug": "encoding-basics",
   "name": "Encoding basics",
   "due": "2026-09-25T16:59:00Z",
   "max_score": 10,
   "collected_at": "2026-10-24T09:23:14Z",
   "submitted": 17
  },
  {
   "slug": "bash-basics",
   "name": "Bash basics",
   "due": "2026-10-02T16:59:00Z",
   "max_score": 10,
   "collected_at": "2026-10-24T09:23:14Z",
   "submitted": 17
  },
  {
   "slug": "git-basics",
   "name": "Git basics",
   "due": "2026-10-09T16:59:00Z",
   "max_score": 10,
   "collected_at": "2026-10-24T09:23:14Z",
   "submitted": 19
  },
  {
   "slug": "automation-basics",
   "name": "Automation basics",
   "due": "2026-10-16T16:59:00Z",
   "max_score": 10,
   "collected_at": "2026-10-24T09:23:14Z",
   "submitted": 16
  },
  {
   "slug": "markup-basics",
   "name": "Markup basics",
   "due": "2026-10-23T16:59:00Z",
   "max_score": 10,
   "collected_at": "2026-10-24T09:23:14Z",
   "submitted": 14
  }
 ],
 "students": [
  {
   "username": "The-Durian-art",
   "display": "Артес Дэннис Андреевич"
  },
  {
   "username": "Semex37",
   "display": "Голоколос Семён Максимович"
  },
  {
   "username": "mrygrz8",
   "display": "Грозная Мария Игоревна"
  },
  {
   "username": "Liondwap",
   "display": "Данилов Лев Антонович"
  },
  {
   "username": "semka39",
   "display": "Дружинин Семён Владимирович"
  },
  {
   "username": "vladimir212455",
   "display": "Мазный Владимир Юрьевич"
  },
  {
   "username": "reznya213",
   "display": "Мирошников Глеб Георгиевич"
  },
  {
   "username": "catinhat01",
   "display": "Обогрелов Илья Павлович"
  },
  {
   "username": "dominik-DeKoko",
   "display": "Пуртов Кирилл Васильевич"
  },
  {
   "username": "KycokXleba",
   "display": "Санжаров Михаил Александрович"
  },
  {
   "username": "Aokdi",
   "display": "Стыпник Святослав Вячеславович"
  },
  {
   "username": "Lavandamosh",
   "display": "Фадеенко Илья Олегович"
  },
  {
   "username": "vebeta",
   "display": "Хегай Владислав Александрович"
  },
  {
   "username": "FunnyGlupik",
   "display": "Чепурченко Григорий Викторович"
  },
  {
   "username": "Bimbusick",
   "display": "Шелепов Кирилл Игоревич"
  },
  {
   "username": "grommoott",
   "display": "Шуваев Григорий Алексеевич"
  },
  {
   "username": "vikxxie",
   "display": "vikxxie"
  }
 ],
 "cells": [
  {
   "student": "vladimir212455",
   "assignment": "automation-basics",
   "score": 10,
   "max_score": 10,
   "review": "approved",
   "fix_submitted": false,
   "pr_url": "https://github.com/nsu-syspro/mpt-automation-basics-vladimir212455/pull/1",
   "release_url": "https://github.com/nsu-syspro/mpt-automation-basics-vladimir212455/releases/tag/submit%2F2026-10-17T13-39-59Z-ac45782"
  },
  {
   "student": "grommoott",
   "assignment": "automation-basics",
   "score": 10,
   "max_score": 10,
   "review": "approved",
   "fix_submitted": false,
   "pr_url": "https://github.com/nsu-syspro/mpt-automation-basics-grommoott/pull/1",
   "release_url": "https://github.com/nsu-syspro/mpt-automation-basics-grommoott/releases/tag/submit%2F2026-10-18T09-41-21Z-6c18e02"
  },
  {
   "student": "mrygrz8",
   "assignment": "automation-basics",
   "score": 10,
   "max_score": 10,
   "review": "approved",
   "fix_submitted": false,
   "pr_url": "https://github.com/nsu-syspro/mpt-automation-basics-mrygrz8/pull/1",
   "release_url": "https://github.com/nsu-syspro/mpt-automation-basics-mrygrz8/releases/tag/submit%2F2026-10-18T09-37-20Z-e6df1fa"
  },
  {
   "student": "Semex37",
   "assignment": "automation-basics",
   "score": 10,
   "max_score": 10,
   "review": "changes_requested",
   "fix_submitted": true,
   "pr_url": "https://github.com/nsu-syspro/mpt-automation-basics-Semex37/pull/1",
   "release_url": "https://github.com/nsu-syspro/mpt-automation-basics-semex37/releases/tag/submit%2F2026-10-18T05-22-42Z-45cd4c6"
  },
  {
   "student": "catinhat01",
   "assignment": "automation-basics",
   "score": 10,
   "max_score": 10,
   "review": "approved",
   "fix_submitted": false,
   "pr_url": "https://github.com/nsu-syspro/mpt-automation-basics-catinhat01/pull/1",
   "release_url": "https://github.com/nsu-syspro/mpt-automation-basics-catinhat01/releases/tag/submit%2F2026-10-22T18-15-12Z-6967471"
  },
  {
   "student": "KycokXleba",
   "assignment": "automation-basics",
   "score": 10,
   "max_score": 10,
   "review": "changes_requested",
   "fix_submitted": false,
   "pr_url": "https://github.com/nsu-syspro/mpt-automation-basics-KycokXleba/pull/1",
   "release_url": "https://github.com/nsu-syspro/mpt-automation-basics-kycokxleba/releases/tag/submit%2F2026-10-17T04-03-17Z-fc4f01e"
  },
  {
   "student": "semka39",
   "assignment": "automation-basics",
   "score": 10,
   "max_score": 10,
   "review": "approved",
   "fix_submitted": false,
   "pr_url": "https://github.com/nsu-syspro/mpt-automation-basics-semka39/pull/1",
   "release_url": "https://github.com/nsu-syspro/mpt-automation-basics-semka39/releases/tag/submit%2F2026-10-21T17-34-12Z-5fc05f2"
  },
  {
   "student": "Bimbusick",
   "assignment": "automation-basics",
   "score": 10,
   "max_score": 10,
   "review": "approved",
   "fix_submitted": false,
   "pr_url": "https://github.com/nsu-syspro/mpt-automation-basics-Bimbusick/pull/1",
   "release_url": "https://github.com/nsu-syspro/mpt-automation-basics-bimbusick/releases/tag/submit%2F2026-10-17T04-02-28Z-56bee30"
  },
  {
   "student": "Liondwap",
   "assignment": "automation-basics",
   "score": 10,
   "max_score": 10,
   "review": "approved",
   "fix_submitted": false,
   "pr_url": "https://github.com/nsu-syspro/mpt-automation-basics-Liondwap/pull/1",
   "release_url": "https://github.com/nsu-syspro/mpt-automation-basics-liondwap/releases/tag/submit%2F2026-10-22T13-34-24Z-f978336"
  },
  {
   "student": "vebeta",
   "assignment": "automation-basics",
   "score": 10,
   "max_score": 10,
   "review": "changes_requested",
   "fix_submitted": false,
   "pr_url": "https://github.com/nsu-syspro/mpt-automation-basics-vebeta/pull/1",
   "release_url": "https://github.com/nsu-syspro/mpt-automation-basics-vebeta/releases/tag/submit%2F2026-10-17T04-04-31Z-a94d41e"
  },
  {
   "student": "Aokdi",
   "assignment": "automation-basics",
   "score": 10,
   "max_score": 10,
   "review": "changes_requested",
   "fix_submitted": false,
   "pr_url": "https://github.com/nsu-syspro/mpt-automation-basics-Aokdi/pull/1",
   "release_url": "https://github.com/nsu-syspro/mpt-automation-basics-aokdi/releases/tag/submit%2F2026-10-17T04-02-19Z-7549633"
  },
  {
   "student": "The-Durian-art",
   "assignment": "automation-basics",
   "score": 10,
   "max_score": 10,
   "review": "changes_requested",
   "fix_submitted": false,
   "pr_url": "https://github.com/nsu-syspro/mpt-automation-basics-The-Durian-art/pull/1",
   "release_url": "https://github.com/nsu-syspro/mpt-automation-basics-the-durian-art/releases/tag/submit%2F2026-10-17T04-04-21Z-f7e8e08"
  },
  {
   "student": "reznya213",
   "assignment": "automation-basics",
   "score": 10,
   "max_score": 10,
   "review": "approved",
   "fix_submitted": false,
   "pr_url": "https://github.com/nsu-syspro/mpt-automation-basics-reznya213/pull/1",
   "release_url": "https://github.com/nsu-syspro/mpt-automation-basics-reznya213/releases/tag/submit%2F2026-10-22T08-43-20Z-1eb28c0"
  },
  {
   "student": "dominik-DeKoko",
   "assignment": "automation-basics",
   "score": 9,
   "max_score": 10,
   "review": "changes_requested",
   "fix_submitted": false,
   "pr_url": "https://github.com/nsu-syspro/mpt-automation-basics-dominik-DeKoko/pull/1",
   "release_url": "https://github.com/nsu-syspro/mpt-automation-basics-dominik-dekoko/releases/tag/submit%2F2026-10-17T04-02-48Z-302bcca"
  },
  {
   "student": "FunnyGlupik",
   "assignment": "automation-basics",
   "score": 9,
   "max_score": 10,
   "review": "changes_requested",
   "fix_submitted": false,
   "pr_url": "https://github.com/nsu-syspro/mpt-automation-basics-FunnyGlupik/pull/1",
   "release_url": "https://github.com/nsu-syspro/mpt-automation-basics-funnyglupik/releases/tag/submit%2F2026-10-17T04-02-58Z-2ff7fd0"
  },
  {
   "student": "Lavandamosh",
   "assignment": "automation-basics",
   "score": 10,
   "max_score": 10,
   "review": "changes_requested",
   "fix_submitted": false,
   "pr_url": "https://github.com/nsu-syspro/mpt-automation-basics-Lavandamosh/pull/1",
   "release_url": "https://github.com/nsu-syspro/mpt-automation-basics-lavandamosh/releases/tag/submit%2F2026-10-22T13-08-39Z-187c22b"
  },
  {
   "student": "vladimir212455",
   "assignment": "bash-basics",
   "score": 10,
   "max_score": 10,
   "review": "approved",
   "fix_submitted": false,
   "pr_url": "https://github.com/nsu-syspro/mpt-bash-basics-vladimir212455/pull/1",
   "release_url": "https://github.com/nsu-syspro/mpt-bash-basics-vladimir212455/releases/tag/submit%2F2026-09-25T13-06-19Z-473c677"
  },
  {
   "student": "Semex37",
   "assignment": "bash-basics",
   "score": 10,
   "max_score": 10,
   "review": "approved",
   "fix_submitted": false,
   "pr_url": "https://github.com/nsu-syspro/mpt-bash-basics-Semex37/pull/1",
   "release_url": "https://github.com/nsu-syspro/mpt-bash-basics-semex37/releases/tag/submit%2F2026-09-26T16-04-49Z-a681029"
  },
  {
   "student": "semka39",
   "assignment": "bash-basics",
   "score": 10,
   "max_score": 10,
   "review": "approved",
   "fix_submitted": false,
   "pr_url": "https://github.com/nsu-syspro/mpt-bash-basics-semka39/pull/1",